{"project_id":"aed15e6c-1d0f-489d-9ba8-36070383b97f","prompt":{"id":"omega_academic_planning","sha256":"15568476f949a1d09769c6ef9906aaf1c0c6cd3a85c258efe84c3bc9e50aeb95","version":1},"questions":[{"canonical_question_number":1,"canonical_text":"Qual é a disciplina que servirá de base para o ebook? Informe, conforme os dados disponíveis, nome, curso ou área, modalidade, carga horária, ementa, posição na formação e documentos institucionais relevantes.","observed_text":"Qual é a disciplina que servirá de base para o ebook? Informe, conforme os dados disponíveis, nome, curso ou área, modalidade, carga horária, ementa, posição na formação e documentos institucionais relevantes.","question_number":1,"wording_status":"normalized_match"},{"canonical_question_number":2,"canonical_text":"Qual é o perfil dos estudantes? Considere formação predominante, experiência profissional, conhecimentos prévios, necessidades, dificuldades de aprendizagem e contexto de atuação.","observed_text":"Qual é o perfil dos estudantes? Considere formação predominante, experiência profissional, conhecimentos prévios, necessidades, dificuldades de aprendizagem e contexto de atuação.","question_number":2,"wording_status":"normalized_match"},{"canonical_question_number":3,"canonical_text":"O que deverá ser aprendido e aplicado ao final da disciplina? Considere objetivo geral, objetivos específicos, competências, resultados de aprendizagem, evidências esperadas e aplicações acadêmicas ou profissionais.","observed_text":"O que deverá ser aprendido e aplicado ao final da disciplina? Considere objetivo geral, objetivos específicos, competências, resultados de aprendizagem, evidências esperadas e aplicações acadêmicas ou profissionais.","question_number":3,"wording_status":"normalized_match"},{"canonical_question_number":4,"canonical_text":"Qual estrutura de capítulos deverá orientar o ebook? Apresente os capítulos na ordem prevista e, quando possível, indique para cada um sua função educacional, conteúdos centrais, divisão interna, conexão com os demais capítulos e temas obrigatórios ou excluídos.","observed_text":"Qual estrutura de capítulos deverá orientar o ebook? Apresente os capítulos na ordem prevista e, quando possível, indique para cada um sua função educacional, conteúdos centrais, divisão interna, conexão com os demais capítulos e temas obrigatórios ou excluídos.","question_number":4,"wording_status":"normalized_match"},{"canonical_question_number":5,"canonical_text":"Quais diretrizes acadêmicas, metodológicas, bibliográficas, editoriais e visuais deverão orientar o ebook? Considere tema, recorte, limites, conceitos, teorias, debates, aplicações, abordagem teórica ou aplicada, métodos, atividades, estudos de caso, autores, fontes, normas, legislação, padrão de citação, tom, formato, identidade visual, elementos obrigatórios e restrições.","observed_text":"Quais diretrizes acadêmicas, metodológicas, bibliográficas, editoriais e visuais deverão orientar o ebook? Considere tema, recorte, limites, conceitos, teorias, debates, aplicações, abordagem teórica ou aplicada, métodos, atividades, estudos de caso, autores, fontes, normas, legislação, padrão de citação, tom, formato, identidade visual, elementos obrigatórios e restrições.","question_number":5,"wording_status":"normalized_match"}],"version":1}
